<?xml version="1.0" encoding="utf-8"?>
<imobiliaria xmlns="http://imobiliaria.org"
             xmlns:xsi="http://www.w3.org/2001/XMLSchema-instance"
             xsi:schemaLocation="http://imobiliaria.org imobiliaria.xsd">
    <imovel id="1">
        <descricao>Apartamento moderno no centro da cidade</descricao>
        <proprietario>
            <nome>João Silva</nome>
            <email>joao.silva@email.com</email>
            <telefone>+55 11 98765-4321</telefone>
            <telefone>+55 11 91234-5678</telefone>
        </proprietario>
        <endereco>
            <rua>Rua das Flores</rua>
            <bairro>Centro</bairro>
            <cidade>São Paulo</cidade>
            <estado>SP</estado>
        </endereco>
        <caracteristicas>
            <tamanho>85.00</tamanho>
            <numQuartos>2</numQuartos>
            <numBanheiros>2</numBanheiros>
        </caracteristicas>
        <valor>450000.00</valor>
    </imovel>

    <imovel id="2">
        <descricao>Casa ampla com quintal</descricao>
        <proprietario>
            <nome>Maria Oliveira</nome>
            <telefone>+55 21 99876-5432</telefone>
        </proprietario>
        <endereco>
            <rua>Avenida das Palmeiras</rua>
            <bairro>Jardim das Acácias</bairro>
            <cidade>Rio de Janeiro</cidade>
            <estado>RJ</estado>
            <numero>456</numero>
        </endereco>
        <caracteristicas>
            <tamanho>200.00</tamanho>
            <numQuartos>4</numQuartos>
            <numBanheiros>3</numBanheiros>
        </caracteristicas>
        <valor>850000.00</valor>
    </imovel>

    <imovel id="3">
        <descricao>Kitnet compacta e funcional</descricao>
        <proprietario>
            <nome>Pedro Santos</nome>
            <email>pedro.santos@email.com</email>
        </proprietario>
        <endereco>
            <rua>Rua do Sol</rua>
            <bairro>Vila Nova</bairro>
            <cidade>Curitiba</cidade>
            <estado>PR</estado>
            <numero>78</numero>
        </endereco>
        <caracteristicas>
            <tamanho>30.00</tamanho>
            <numQuartos>1</numQuartos>
            <numBanheiros>1</numBanheiros>
        </caracteristicas>
        <valor>120000.00</valor>
    </imovel>

    <imovel id="4">
        <descricao>Sobrado com piscina</descricao>
        <proprietario>
            <nome>Ana Costa</nome>
            <telefone>+55 31 98765-4321</telefone>
        </proprietario>
        <endereco>
            <rua>Rua das Acácias</rua>
            <bairro>Jardim Primavera</bairro>
            <cidade>Belo Horizonte</cidade>
            <estado>MG</estado>
            <numero>0</numero>
        </endereco>
        <caracteristicas>
            <tamanho>250.00</tamanho>
            <numQuartos>5</numQuartos>
            <numBanheiros>4</numBanheiros>
        </caracteristicas>
        <valor>1200000.00</valor>
    </imovel>

    <imovel id="5">
        <descricao>Chácara com área verde</descricao>
        <proprietario>
            <nome>Lucas Almeida</nome>
            <email>lucas.almeida@email.com</email>
            <telefone>+55 19 91234-5678</telefone>
        </proprietario>
        <endereco>
            <rua>Estrada do Campo</rua>
            <bairro>Zona Rural</bairro>
            <cidade>Campinas</cidade>
            <estado>SP</estado>
            <numero>0</numero>
        </endereco>
        <caracteristicas>
            <tamanho>5000.00</tamanho>
            <numQuartos>3</numQuartos>
            <numBanheiros>2</numBanheiros>
        </caracteristicas>
        <valor>2500000.00</valor>
    </imovel>
</imobiliaria>